text,label
Điểm chuẩn năm nay tính theo thang điểm 40 kiểu gì vậy ạ?,ADMISSION
Nếu em thi ĐGNL thì điểm ưu tiên khu vực tính như nào?,ADMISSION
Tra cứu điểm trúng tuyển ở link nào ấy nhỉ?,ADMISSION
PT4 là xét hs quốc tế hả thầy/cô?,ADMISSION
Điểm trúng tuyển các phương thức có đổi qua lại được không ạ?,ADMISSION
- Hạn chót nộp hồ sơ xét tuyển bổ sung là khi nào vậy ạ?,ADMISSION
- Cho em hỏi chương trình học ở phân hiệu Khánh Hòa thì học phí có khác gì so với ở SG ko ạ?,ADMISSION
- Chương trình dự bị đh bằng tiếng Anh có khác gì so với chương trình đại học bằng tiếng Anh không ạ?,ADMISSION
- Nếu em muốn học Quản trị kinh doanh thì nên chọn chương trình liên kết nào tốt nhất ạ? Có yêu cầu tiếng Anh đầu vào không?,ADMISSION
"- Em thấy có nhiều phương thức xét tuyển quá, sv mình hay chọn phương thức nào để dễ đậu nhất vậy ạ?",ADMISSION
Trang tra cứu kết quả trúng tuyển của TDTU mở từ 24/8 hả thầy/cô?,ADMISSION
Trước 5h chiều 30/8 phải xác nhận nhập học trên hệ thống của Bộ GDĐT hả mn?,ADMISSION
Nếu trúng tuyển thì bắt buộc phải xác nhận nhập học online trên hệ thống của Bộ trước khi lên trường làm thủ tục nhập học đúng ko ạ?,ADMISSION
Xác nhận nhập học online trên hệ thống của Bộ GDĐT xong thì mới làm thủ tục nhập học ở trường đh TDTU được hả các bạn?,ADMISSION
Website tra cứu kết quả xét tuyển là https://tracuuxettuyen.tdtu.edu.vn phải ko mọi người?,ADMISSION
Khi nào thì mình xem được thư mời nhập học online vậy ạ?,ADMISSION
Trang tracuuxettuyen.tdtu.edu.vn là trang nào vậy ta?,ADMISSION
Vậy là phải lên trường nhập học mới có thư mời bản gốc hả thầy/cô?,ADMISSION
Nếu k xem được thư mời online thì sao ạ?,ADMISSION
Thư mời nhập học có quan trọng lắm không thầy/cô?,ADMISSION
Nhập học từ 25/8 đến 30/8 là phải lên trường làm thủ tục luôn hả ad?,ADMISSION
Trang https://tracuuxettuyen.tdtu.edu.vn có hướng dẫn chi tiết nhập học chưa vậy?,ADMISSION
Nếu trúng tuyển chương trình ở Khánh Hòa thì bắt buộc nhập học ở đó luôn hả mọi người?,ADMISSION
Thời gian nhập học đến 5h chiều 30/8 là hết hạn luôn đúng ko ạ?,ADMISSION
Sv TDTU nhập học ở cơ sở Tân Hưng là chỗ nào vậy mấy bạn?,ADMISSION
Vậy là 24/8/2025 mới có kết quả trúng tuyển hả ad?,ADMISSION
Trang tracuuxettuyen với admission cái nào chính xác hơn để tra cứu vậy?,ADMISSION
Thư mời nhập học online hay gửi về nhà vậy ạ?,ADMISSION
"Hướng dẫn thủ tục nhập học có chi tiết không, sv năm nay bỡ ngỡ quá :(",ADMISSION
Nộp học phí online luôn trên trang đó được không ad?,ADMISSION
Nộp bản photo giấy cmt kết quả thi trc 30/8 hả mng?,ADMISSION
Ai có chứng chỉ TA thì nộp bản photo lun hả mn?,ADMISSION
"Nhập học có cần in sẵn ""Phiếu thông tin sv"" ko ta?",ADMISSION
Lịch ktra TA xếp lớp xem ở đâu v mn?,ADMISSION
Mấy khoản phí nhập học có thanh toán online đc ko nhỉ?,ADMISSION
Hậu kiểm hồ sơ gắt vậy hả trường?,ADMISSION
Nếu lỡ khai sai xíu xíu thôi có bị hủy kết quả trúng tuyển liền ko ạ?,ADMISSION
Tuần SHCD bắt đầu từ 3/9/2025 là bắt buộc tham gia đúng ko ạ?,ADMISSION
Có lịch học cụ thể cho tuần SHCD chưa trường ơi?,ADMISSION
Nếu có vấn đề gì cần hỏi thì cứ gọi hotline tuyển sinh là nhanh nhất đúng ko ạ?,ADMISSION
*   Năm sau trường mình có mấy phương thức xét tuyển đh vậy?,ADMISSION
*   Link admission.tdtu.edu.vn có đủ thông tin chi tiết từng phương thức xét tuyển 2025 ko ạ?,ADMISSION
*   Phương thức xét 6HK là xét điểm TB cả 3 năm cấp 3 luôn hả mn?,ADMISSION
*   Đánh giá năng lực ĐHQG năm sau vẫn được xét vào TDTU hả ta?,ADMISSION
*   Ưu tiên xét tuyển của TDTU là có những đối tượng nào vậy ạ?,ADMISSION
Cho em hỏi là mình đăng ký trên hệ thống của Bộ xong rồi mới đăng ký trên web xét tuyển TDTU hả thầy/cô?,ADMISSION
Vậy là phải nộp hết mấy cái chứng chỉ ngoại ngữ với thành tích trước 25/7 luôn hả ad?,ADMISSION
"Hệ thống của Bộ GDĐT mở đăng ký từ 16/7, còn hệ thống TDTU mở từ 25/5, vậy mình nộp hồ sơ trên web trg mình trước đc ko ạ?",ADMISSION
Nếu sv chỉ xét điểm thi THPTQG thì có cần đăng ký trên web xét tuyển của trg ko ạ?,ADMISSION
Cái cộng điểm khuyến khích là những loại nào đc cộng vậy thầy cô?,ADMISSION
Hạn chót đăng ký nguyện vọng xét tuyển là khi nào vậy ạ?,ADMISSION
Nếu chưa có tài khoản trên hệ thống của Bộ thì phải làm sao?,ADMISSION
Thời gian đăng ký tài khoản trên hệ thống của Bộ là khi nào vậy ạ?,ADMISSION
Lệ phí xét tuyển đóng ở đâu và đóng như thế nào vậy mọi người?,ADMISSION
Tdtu mình có những phương thức tuyển sinh nào vậy ạ?,ADMISSION
Nộp chứng chỉ ngoại ngữ với minh chứng cộng điểm khuyến khích cùng lúc luôn hả thầy cô?,ADMISSION
Nếu sv xét bằng điểm THPT thì có cần nộp bản cứng minh chứng cộng điểm khuyến khích không ạ?,ADMISSION
"Link phụ lục 5, 7, 8 ở đâu vậy ạ?",ADMISSION
Nếu xét đh bằng tiếng Anh thì bắt buộc phải có chứng chỉ ngoại ngữ hả TDTU?,ADMISSION
Đăng ký thông tin ngành dự kiến để được tư vấn là bắt buộc hay tự nguyện vậy ạ?,ADMISSION
- TDTU lấy dữ liệu điểm 6HK với điểm thi THPT 2025 trên hệ thống của Bộ luôn hả thầy/cô?,ADMISSION
"- Vậy nếu sv có chứng chỉ ngoại ngữ thì phải nộp trên hệ thống của TDTU để được cộng điểm, đúng ko ạ?",ADMISSION
- Nếu em ko nộp chứng chỉ trên hệ thống thì coi như mất quyền lợi cộng điểm luôn hả thầy/cô?,ADMISSION
- Tốt nghiệp THPT trước 2025 mà muốn học liên kết quốc tế thì phải nộp thêm học bạ trên hệ thống TDTU hả mn?,ADMISSION
"- Cái ""minh chứng cộng điểm khuyến khích"" là những giấy tờ gì vậy ạ?",ADMISSION
Mấy ngành năng khiếu bắt buộc phải thi ở TDTU hả mọi người?,ADMISSION
Link đăng ký thi năng khiếu là link nào ấy nhỉ?,ADMISSION
Thi năng khiếu 3 đợt lấy điểm cao nhất đúng ko ta?,ADMISSION
Ai thi liên kết quốc tế phải phỏng vấn à?,ADMISSION
Link đăng ký phỏng vấn ở đâu vậy mấy bro?,ADMISSION
Cho em hỏi web admission.tdtu.edu.vn là chỗ đăng tin tuyển sinh các hệ đh hả thầy/cô?,ADMISSION
Thông tin tuyển sinh trên web đó có đầy đủ hết ko ạ?,ADMISSION
Vậy là sv cứ theo dõi web đó để biết thông tin tuyển sinh mới nhất của TDTU đúng ko?,ADMISSION
Web admission có thông tin về chỉ tiêu tuyển sinh của từng ngành ko ạ?,ADMISSION
Nếu có thắc mắc về tuyển sinh thì liên hệ ai qua web đó được ko ạ?,ADMISSION
Em muốn hỏi về chương trình liên kết thì gọi hotline nào ạ?,ADMISSION
Nếu em muốn hỏi về thủ tục nhập học thì gọi số nào nhanh nhất ạ?,ADMISSION
Tư vấn tuyển sinh ĐH TDTU thì nên email hay gọi điện?,ADMISSION
Sđt 028 37 755 051 với 028 37 755 052 khác gì nhau không ạ?,ADMISSION
Hotline 19002024 có hỗ trợ 24/7 ko ạ?,ADMISSION
Cho em hỏi là năm sau TDTU có những ngành nào mới không ạ?,ADMISSION
Chương trình tiên tiến khác gì chương trình tiêu chuẩn vậy thầy/cô?,ADMISSION
Nếu em thi đánh giá năng lực ĐHQG thì cơ hội đậu cao hơn không ạ?,ADMISSION
Phương thức xét học bạ 6HK thì cần điểm TB mỗi HK bao nhiêu mới chắc chắn đậu?,ADMISSION
"""Ưu tiên xét tuyển"" của TDTU là những đối tượng nào được ưu tiên vậy ạ?",ADMISSION
Mấy chương trình liên kết quốc tế có khác gì về điều kiện tốt nghiệp THPT so với chương trình thường ko?,ADMISSION
Trang tra cứu trường ký kết kia có update thường xuyên ko nhỉ?,ADMISSION
Vậy là tất cả các ngành của trường đều xét học bạ 6 học kỳ hả mn?,ADMISSION
Ngưỡng đảm bảo chất lượng quy đổi là cái gì vậy ta? Sv mới chưa hiểu lắm.,ADMISSION
Nếu có chứng chỉ tiếng Anh thì có lợi thế gì khi xét tuyển vào đh TDTU ko?,ADMISSION
Hạn chót nộp chứng chỉ TA với minh chứng cộng điểm là khi nào á?,ADMISSION
Sau 28/7 là hết hạn đăng ký NVXT trên hệ thống bộ GD&ĐT hả mn?,ADMISSION
Ngưỡng đảm bảo chất lượng đầu vào của TDTU khi nào có vậy?,ADMISSION
Điểm xét tuyển tính theo thang 40 là tính kiểu gì vậy mấy bro?,ADMISSION
Trường xét tuyển theo thứ tự nguyện vọng mình đăng ký trên hệ thống bộ luôn hả?,ADMISSION
- Vậy là năm sau sv tốt nghiệp THPT dùng điểm ĐGNL ĐHQG để xét vào TDTU được hả thầy/cô?,ADMISSION
- Nếu điểm ĐGNL của em cao hơn 900 thì điểm ưu tiên tính kiểu khác hả thầy/cô?,ADMISSION
- Phụ lục 6 với phụ lục 3 xem ở đâu vậy ạ?,ADMISSION
- Ngưỡng đảm bảo chất lượng đầu vào của phương thức này khi nào trường mình công bố vậy ạ?,ADMISSION
- Đăng ký nguyện vọng xét tuyển trên hệ thống của Bộ GD&ĐT là đăng ký như bình thường đúng ko thầy/cô?,ADMISSION
- Tóm lại là nếu tốt nghiệp THPT ở nc ngoài thì phải có cái giấy c.nhận văn bằng tương đương mới đc xét đúng ko ạ?,ADMISSION
- Cái điểm xét tuyển 24.0 trên 40 là tính theo tổ hợp môn mình chọn hay sao á?,ADMISSION
- Nếu đủ đk tiếng Anh thì auto đc ưu tiên vào mấy chương trình tiếng Anh với lkqt hả thầy/cô?,ADMISSION
"- Hạn đk là 25/7, mà nếu chưa có tài khoản trên hệ thống của Bộ thì phải làm trc 20/7 đúng ko ạ?",ADMISSION
"- Cái phiếu đk tải ở đâu trên web tdtu á, admission nằm chỗ nào v ạ?",ADMISSION
Web admission tdtu có thông tin tuyển thẳng mới chưa vậy?,ADMISSION
Có ai biết đợt xét tuyển thẳng theo quy chế của Bộ GD&ĐT đợt này có khác gì năm ngoái ko?,ADMISSION
Vậy là cứ theo thông báo trên web admission của trường thôi đúng ko mng?,ADMISSION
"Sv mình có ai apply xét tuyển thẳng đợt này chưa, cho xin ít kinh nghiệm vs!",ADMISSION
Thông tin xét tuyển thẳng đh tdtu năm nay có những ngành nào hot nhỉ?,ADMISSION
"Alo, cho em hỏi cái hotline 19002024 gọi giờ nào cũng được hả ad?",ADMISSION
Email tuvantuyensinh@tdtu.edu.vn là hỏi chung chung được đúng ko ạ?,ADMISSION
Số đt (028) 37 755 051 với (028) 37 755 052 khác gì nhau á trường?,ADMISSION
Sv muốn hỏi về liên kết quốc tế thì gọi 0935 035 270 hay email nhanh hơn ạ?,ADMISSION
Web admission.tdtu.edu.vn có hết thông tin tuyển sinh đh không vậy?,ADMISSION
Thi năng khiếu mình thi mấy môn zậy thầy/cô?,ADMISSION
Nếu thi rớt đợt 1 thì mình thi lại đợt 2 được ko ạ?,ADMISSION
Địa điểm thi đợt 2 ở Nha Trang đúng ko thầy/cô?,ADMISSION
Link đăng ký thi năng khiếu là link nào vậy ạ?,ADMISSION
Sv mình thi năng khiếu có cần chuẩn bị gì đặc biệt ko thầy/cô?,ADMISSION
IELTS 5.0 mà hết hạn trc 1/10/2025 thì có đc xét ko ạ?,ADMISSION
Chương trình dự bị đh có phải đóng học phí ko?,ADMISSION
Nếu ko có IELTS thì bắt buộc phải học dự bị hả thầy/cô?,ADMISSION
Sv quốc tịch Anh thì auto đậu chương trình tiếng Anh đúng ko ạ?,ADMISSION
IELTS 5.5 mà nộp vào chương trình đh tiếng Anh thì có đc ko ta?,ADMISSION
Web admission của TDTU có bản tiếng Việt ko ạ?,ADMISSION
Deadline nộp hồ sơ đh là khi nào vậy?,ADMISSION
Thông tin tuyển sinh trên web có khác gì so với năm ngoái ko?,ADMISSION
Sv năm nhất có cần đọc kỹ hết thông tin trên web ko ta?,ADMISSION
Trên web có hướng dẫn chi tiết cách apply ko mọi người?,ADMISSION
IELTS 5.0 là đủ để học tất cả các ngành dạy bằng tiếng Anh ở TDTU hả?,ADMISSION
Nếu ko có IELTS thì có cách nào khác để vào học chương trình đh dạy bằng tiếng Anh ko?,ADMISSION
Chương trình dạy bằng tiếng Việt và tiếng Anh khác gì chương trình dạy hoàn toàn bằng tiếng Việt?,ADMISSION
Học tiếng Việt ở TDTU 1 năm thì chắc chắn đạt B2 hả thầy/cô?,ADMISSION
Sv quốc tế học ngành Việt Nam học - Văn hóa thì cần A2 thôi đúng ko ạ?,ADMISSION
Vậy là học bổng chỉ có cho chương trình tiếng Việt với tiếng Anh thôi hả?,ADMISSION
Chương trình liên kết quốc tế với chương trình song ngữ Anh-Việt là không có học bổng đúng ko ạ?,ADMISSION
Nếu ko apply học bổng thì mình có nhiều lựa chọn ngành hơn hả thầy/cô?,ADMISSION
Vậy chương trình tiếng Anh hoàn toàn mà không có học bổng thì khác gì chương trình có học bổng ạ?,ADMISSION
"Link admission requirement ở đâu vậy ạ, em tìm mãi ko thấy?",ADMISSION
Web trường mình là web nào vậy ạ?,ADMISSION
"""How to apply"" nằm ở đâu trên web TDTU vậy ta?",ADMISSION
Các bước apply đó là apply cái gì vậy mấy bạn?,ADMISSION
Sv mới như mình thì nên bắt đầu từ đâu nhỉ?,ADMISSION
Có ai có link hướng dẫn apply nhanh cho mình xin với!,ADMISSION
Nếu hồ sơ đạt yêu cầu thì mình chỉ cần đợi kết quả thôi hả thầy/cô?,ADMISSION
Nếu hồ sơ bị trả thì mình cần sửa/bổ sung những gì ạ?,ADMISSION
"""Meet requirements"" ở đây là cụ thể những gì vậy ạ?",ADMISSION
Khi nào thì sv biết hồ sơ có ok hay ko vậy?,ADMISSION
Nếu cần update hồ sơ thì mình liên hệ ai ở đâu vậy TDTU?,ADMISSION
TDTU sẽ gửi Admission Letter và Enrolment Confirmation Letter qua đâu vậy ạ?,ADMISSION
Nếu có học bổng thì thông báo ở đâu trong Admission Letter hả thầy/cô?,ADMISSION
"Check-list hướng dẫn đến VN và link đăng ký visa, ký túc xá nằm ở đâu vậy ạ?",ADMISSION
Sau khi điền Enrolment Confirmation Letter và đăng ký online thì khoảng bao lâu sv nhận được visa ạ?,ADMISSION
Nếu visa có vấn đề thì trường sẽ báo cho sv biết như thế nào ạ?,ADMISSION
- Vậy là sv nào học tiếng Việt/Anh 1 năm thì nộp lại hồ sơ nhập học đã scan thôi đúng ko ạ?,ADMISSION
- Còn sv học thẳng đh TDTU thì nộp những gì vậy ạ? Hồ sơ nhập học với hồ sơ gì nữa ạ?,ADMISSION
- Cái link chi phí ước tính ở đâu vậy ạ?,ADMISSION
- Đổi tiền VND ở đâu tiện nhất vậy mn?,ADMISSION
- Mấy thứ cần thiết cho cuộc sống ở VN là chuẩn bị những gì vậy ạ?,ADMISSION
Visa approval letter là trg gửi qua email hả mn?,ADMISSION
Check visa availability ở ĐSQ/LSQ kiểu gì v ạ? Gọi điện hỏi đc ko?,ADMISSION
TDTU báo kết quả visa khi nào zậy? Lâu ko ạ?,ADMISSION
Nếu có visa approval letter rồi thì đi lấy visa luôn đc hả?,ADMISSION
Địa chỉ ĐSQ/LSQ mình đăng ký lúc apply online xem ở đâu nhỉ? Quên mất tiu :((,ADMISSION
Visa xong rồi thì mua vé bay liền đc ko thầy/cô?,ADMISSION
Ai ko ở kí túc xá TDTU thì tự book vé đi hả thầy/cô?,ADMISSION
Ngày nhập học bắt buộc phải có mặt ở Q7 đúng ko ạ?,ADMISSION
Giấy tờ cần mang theo nhập học là những gì vậy thầy/cô?,ADMISSION
Nếu đến trễ ngày nhập học có sao ko ạ?,ADMISSION
Cho em hỏi là nên báo giờ đến trc bao lâu ạ?,ADMISSION
Mua sim 4G của nhà mạng nào ở sân bay ổn áp nhất ạ?,ADMISSION
Xe bus vàng ở sân bay có chuyến nào đi thẳng Q7 gần ĐH TDTU ko ạ?,ADMISSION
Đi bus từ Q1 về trường thì bắt tuyến nào tiện nhất sv nhỉ?,ADMISSION
Nếu đi Grab/Be từ sân bay về ký túc xá TDTU thì tầm bao nhiêu tiền ạ?,ADMISSION
TDTU mình cần chuẩn bị những gì để apply vào trường vậy?,ADMISSION
Hồ sơ apply đh TDTU có khác gì so với mấy trường khác ko ta?,ADMISSION
Click vào đâu để xem chi tiết quy trình apply vào TDTU vậy ad?,ADMISSION
Sv mới như mình có cần chuẩn bị thêm gì ngoài mấy thứ cơ bản ko?,ADMISSION
TDTU có tips nào để hồ sơ apply của mình nổi bật hơn không ạ?,ADMISSION
Mấy link hướng dẫn cho sv quốc tế khác nhau hả thầy/cô?,ADMISSION
List ngành học bằng tiếng Việt với tiếng Anh khác nhau chỗ nào á?,ADMISSION
Hồ sơ với thủ tục nhập học xem ở đâu cho đầy đủ vậy ạ?,ADMISSION
Học bổng của TDTU có những loại nào vậy thầy/cô?,ADMISSION
Thông báo tuyển sinh với điều kiện xét tuyển xem ở đâu ạ?,ADMISSION
INCRETI ở lầu mấy vậy ạ?,ADMISSION
Địa chỉ email này chỉ để hỏi về chương trình đh thôi hả?,ADMISSION
Số điện thoại này gọi giờ hành chính đúng ko ạ?,ADMISSION
INCRETI bên F Building có dễ tìm ko ta?,ADMISSION
INCRETI này có liên quan gì tới việc trao đổi sv ko ạ?,ADMISSION
- Xác nhận nhập học trên hệ thống Bộ GDĐT là bắt buộc hả thầy/cô?,ADMISSION
- Nếu thanh toán phí trc online thì tới trường có cần nộp lại k ạ?,ADMISSION
- Chứng chỉ tiếng Anh phải thi trực tiếp mới được hả thầy/cô?,ADMISSION
- Em chưa có chứng chỉ TA thì sao ạ? Có cần bổ sung sau k?,ADMISSION
- Hạn chót làm thủ tục nhập học trực tiếp là ngày mấy vậy ạ?,ADMISSION
Chương trình tiêu chuẩn khác gì tiên tiến vậy ạ?,ADMISSION
Học phí chương trình tiên tiến có cao hơn nhiều ko?,ADMISSION
Sv học đh bằng tiếng Anh thì điều kiện đầu vào sao ạ?,ADMISSION
Liên kết đào tạo quốc tế có phải học hoàn toàn ở nước ngoài ko?,ADMISSION
Học ở phân hiệu Khánh Hòa thì có khác gì học ở TDTU HCM ko ạ?,ADMISSION
Giấy CNKQ thi THPT photo có cần công chứng ko ạ?,ADMISSION
Nếu ko có chứng chỉ TA quốc tế thì sao ta?,ADMISSION
Học bạ điện tử trường em ko đóng dấu giáp lai thì có sao ko ạ?,ADMISSION
"Phiếu thông tin sv với giấy xác nhận ""Những điều cần biết..."" là mình in ở đâu zậy?",ADMISSION
Mở thẻ SV tích hợp ngân hàng Vietcombank có bắt buộc ko ạ?,ADMISSION
- Trang tracuuxettuyen.tdtu.edu.vn đăng ký KTX ở chỗ nào á?,ADMISSION
- Nếu nguyện vọng 1 hết chỗ thì nguyện vọng 2 có bị loại luôn ko ạ?,ADMISSION
- Nộp hồ sơ KTX ở khu vực nào vậy ạ?,ADMISSION
- Sv mới nhập học mà muốn ở tạm KTX thì liên hệ ai?,ADMISSION
- Giấy tờ ưu tiên chính sách cần công chứng những loại nào vậy ạ?,ADMISSION
"- Alo, cho em hỏi mẫu xác nhận ""Những điều cần biết..."" tải ở đâu á?",ADMISSION
- Nếu em có thắc mắc về chương trình liên kết quốc tế thì liên hệ email nào ạ?,ADMISSION
- Số 0914 137 328 chỉ hỗ trợ về học phí thôi đúng không ạ?,ADMISSION
- Em muốn hỏi về hồ sơ sv nhập học thì gọi số nào vậy ạ?,ADMISSION
"- Trường mình có chỗ nào để xem trước ""Những điều cần biết khi học tại TDTU"" không ạ?",ADMISSION
Thầy/Cô nào là trưởng bộ môn vậy ạ?,GENERAL
Ai là tổ trưởng công đoàn trường mình vậy?,GENERAL
Cô Châu Anh Thy làm ở đâu vậy ạ?,GENERAL
Email của thầy Trần Quốc Cường là gì ạ?,GENERAL
Liên hệ cô Cao Phi Phụng để làm gì vậy ạ?,GENERAL
CAIT có lớp học cho sv TDTU mình ko ạ?,GENERAL
Trung tâm có hỗ trợ gì cho sv làm đồ án liên quan đến IT ko?,GENERAL
CAIT có tuyển thực tập sinh ko ạ? Yêu cầu là gì?,GENERAL
Mình muốn học thêm về AI thì CAIT có khóa nào phù hợp ko ạ?,GENERAL
CAIT có tham gia vào việc phát triển app TDTU ko ạ?,GENERAL
"Trung tâm Tin học có khóa học nào mới, hot trend cho sv TDTU không ạ?",GENERAL
"""Giải pháp đột phá"" mà trung tâm nói tới cụ thể là những dự án nào vậy ạ?",GENERAL
Trung tâm có chương trình hợp tác với doanh nghiệp nào để sv có cơ hội thực tập không?,GENERAL
Trung tâm có tổ chức workshop hay sự kiện gì liên quan đến chuyển đổi số cho sv đh không ạ?,GENERAL
"""Phát triển bền vững"" ở đây là trung tâm có hoạt động nào hướng đến cộng đồng không ạ?",GENERAL
Trung tâm Tin học có tuyển sv thực tập không ạ?,GENERAL
Giảng viên ở trung tâm có hay chia sẻ kinh nghiệm thực tế cho sv TDTU không?,GENERAL
Học ở trung tâm thì có cơ hội tham gia mấy dự án chuyển đổi số của trường không ạ?,GENERAL
Trung tâm có những khóa học nào dành riêng cho sv đh mình không?,GENERAL
Sau khi học xong các khóa ở trung tâm thì có dễ xin việc hơn không ạ?,GENERAL
TDTU mình có nhiều dự án phần mềm với cty ngoài zậy ta?,GENERAL
Mấy cái trang thông tin điện tử này là khoa nào làm nhiều nhất á thầy/cô?,GENERAL
Cathay Life làm 2 cái hệ thống đào tạo trực tuyến luôn hả?,GENERAL
Đề tài thịt bò một nắng là của khoa nào vại?,GENERAL
Sv mình có được tham gia mấy dự án kiểu này không ạ?,GENERAL
Trung tâm tin học ở phòng A708 thiệt hả ta?,GENERAL
Sdt này gọi giờ hành chính là có ng nghe máy ko ạ?,GENERAL
Email này mình hỏi về lịch học tin học đc ko?,GENERAL
Trung tâm tin học có dạy các lớp ngắn hạn cho sv TDTU ko nhỉ?,GENERAL
Anh/chị cho em hỏi học phí các lớp ở trung tâm tin học ntn ạ?,GENERAL
Mấy cái PLO này để làm gì vậy thầy/cô?,ACADEMIC
"PLO 1, 2, 3,... là sao, có khác nhau nhiều ko ạ?",ACADEMIC
Học xong mấy cái này thì sv TDTU mình làm được những gì?,ACADEMIC
PLO nào quan trọng nhất cho sv ngành CNTT vậy thầy/cô?,ACADEMIC
Làm sao để biết mình đạt được mấy cái PLO này sau khi tốt nghiệp đh?,ACADEMIC
Mấy cái PLOs này để làm gì vậy thầy/cô?,ACADEMIC
PLO 1 với PLO 2 khác nhau chỗ nào á? Sao em thấy nó hơi giống nhau?,ACADEMIC
"PLO 3 bảo học tập suốt đời, vậy trường mình có chương trình gì hỗ trợ sv đh TDTU vụ này ko ạ?",ACADEMIC
"PLO 4 có cái ""hệ thống liên ngành"", cho em xin ví dụ cụ thể được không ạ?",ACADEMIC
"PLO 5 nói về giao tiếp, vậy có nghĩa là tụi em cần rèn luyện kỹ năng mềm nhiều hơn hả thầy/cô?",ACADEMIC
PLO1 có nghĩa là tụi sv xây dựng mình cần học mấy cái đường lối chủ trương hả thầy/cô?,ACADEMIC
PLO2 yêu cầu tiếng anh cỡ nào thì đủ để đáp ứng việc thiết kế với thi công vậy ạ?,ACADEMIC
"PLO3a với PLO4 khác nhau chỗ nào, khi nào thì dùng cái nào cho hợp lý?",ACADEMIC
"Mấy cái phần mềm ngành ở PLO5 là những phần mềm nào vậy thầy/cô, có được học hết ở đh TDTU không?",ACADEMIC
"PLO6a bảo tự học, vậy trường có hỗ trợ nguồn tài liệu hay hướng dẫn gì cho sv tụi em không ạ?",ACADEMIC
"PLO1 nói về đường lối nhà nước, vậy có tài liệu nào tham khảo thêm ko ạ?",ACADEMIC
"PLO2 bảo dùng tiếng Anh hiệu quả, vậy có yêu cầu cụ thể về trình độ (IELTS, TOEIC...) không thầy/cô?",ACADEMIC
"PLO3b và PLO4 đều là ""Apply"", khác nhau chỗ nào vậy ạ?",ACADEMIC
"PLO5 liệt kê phần mềm, vậy trường mình có training mấy phần mềm đó ko ạ?",ACADEMIC
"PLO7 có kỹ năng quản lý, vậy sv có cơ hội thực hành mấy kỹ năng này ở đâu ngoài giờ học ko ạ?",ACADEMIC
Mấy cái PLOs này mình cần nắm vững hết để làm gì vậy thầy/cô?,ACADEMIC
"""Phát triển ý tưởng nghiên cứu"" ở mục 1 có nghĩa là mình tự nghĩ đề tài hay sao ạ?",ACADEMIC
"Kỹ năng ""ứng dụng mô hình kinh doanh phù hợp"" ở mục 2 là mình học những mô hình nào cụ thể vậy ạ?",ACADEMIC
"Cái ""định hướng học tập suốt đời"" ở mục 3 là sao ta, trường mình có chương trình gì hỗ trợ sv vụ này ko?",ACADEMIC
"Vậy tóm lại, mấy cái này quan trọng nhất với sv TDTU khi ra trường đi làm là cái nào ạ?",ACADEMIC
PLO này có nghĩa là sau khi ra trường sv phải làm được những gì hả thầy/cô?,ACADEMIC
