text,label
Học phí từng tín chỉ của các ngành khác nhau thế nào ấy nhỉ?,ACADEMIC
Nếu học lại thì tính học phí sao ạ?,ACADEMIC
"""Học phần chuyên ngành"" là những môn nào vậy ạ?",ACADEMIC
Học phí này có thay đổi theo từng năm học ko ạ?,ACADEMIC
Học phí tiến sĩ của sv tdtu đóng theo kỳ là cố định hết 3 năm hả thầy/cô?,ACADEMIC
Nếu mình có bằng thạc sĩ thì tổng học phí hết khoá là bao nhiêu vậy ạ?,ACADEMIC
Trễ tiến độ thì mỗi kì đóng có 7tr5 thôi hả thầy/cô?,ACADEMIC
Nếu mình có bằng đh thì thời gian học và học phí khác gì so với có bằng thạc sĩ không ạ?,ACADEMIC
"Học phí này đã bao gồm các khoản khác chưa ạ, hay còn phí gì phát sinh nữa không thầy/cô?",ACADEMIC
Cho em hỏi đóng tiền học phí online thì cách nào nhanh nhất ạ?,ACADEMIC
VCB Digibank là app Vietcombank đúng ko ạ?,ACADEMIC
Nếu đóng bằng Mobile Banking thì ngân hàng nào cũng được hả thầy/cô?,ACADEMIC
Đóng trực tiếp ở ngân hàng thì cần mang theo cái gì không ạ?,ACADEMIC
"TDTU mình có quy định giờ chót đóng tiền không, lỡ quá hạn có sao ko ạ?",ACADEMIC
- Vậy là sv nước ngoài tốt nghiệp đh ở đâu cũng apply thạc sĩ TDTU được hả thầy/cô?,ACADEMIC
"- ""Từ năm 2025 trở về sau"" nghĩa là năm nay (2024) ko apply được luôn hả thầy/cô?",ACADEMIC
- CTĐT tiếng Việt/Anh là sao ạ? Có ngành nào khác ko thầy/cô?,ACADEMIC
"- Lưu học sinh có khác gì sv Việt Nam mình ko thầy/cô? (ví dụ học phí, học bổng...)",ACADEMIC
"- Điều kiện ""đủ điều kiện trúng tuyển"" cụ thể là gì vậy thầy/cô?",ACADEMIC
Điểm tb tích lũy đh/thạc sĩ quan trọng cỡ nào zậy thầy/cô?,ACADEMIC
NCKH là tính cả mấy cái mình làm ở clb luôn hả thầy/cô?,ACADEMIC
Trường mình có nằm trong mấy cái bảng xếp hạng THE/QS/URAP/ARWU đó ko ạ?,ACADEMIC
"Ưu tiên quốc gia là sao ta, sv quốc tế có lợi hơn sv Việt Nam ko thầy/cô?",ACADEMIC
Phỏng vấn thì hỏi những gì để chứng minh mình có khả năng học tốt ở TDTU ạ?,ACADEMIC
Học bổng này chỉ áp dụng cho năm nhất thôi hả thầy/cô?,ACADEMIC
Điểm tb 3.4 trở lên là tính điểm đh hay điểm thạc sĩ vậy ạ?,ACADEMIC
Ký túc xá năm nhất là auto đc free hay sao ạ?,ACADEMIC
Vậy nếu ko ở ktx thì có đc quy đổi ra tiền mặt ko ta?,ACADEMIC
Phí nhập học là phí gì vậy mọi người?,ACADEMIC
Cho em hỏi là điểm tb tích lũy là tính hết tất cả các môn đh hả thầy/cô?,ACADEMIC
Nếu em được học bổng 50% học phí năm nhất thì có cần làm thủ tục gì thêm ko ạ?,ACADEMIC
Kí túc xá được free năm nhất là phòng mấy người vậy ạ?,ACADEMIC
Nếu điểm em đủ nhưng chưa có bằng thì có được xét học bổng trước ko thầy/cô?,ACADEMIC
"50% phí nhập học là trừ trực tiếp hay sao á thầy/cô, hay sv phải đóng rồi trường hoàn lại ạ?",ACADEMIC
Cho em hỏi là điểm tb tích lũy của em 3.2 thì chắc chắn được học bổng đúng ko ạ?,ACADEMIC
Nếu em không ở ký túc xá thì có được quy đổi 100% phí ký túc xá thành tiền mặt không ạ?,ACADEMIC
25% học phí năm nhất là trừ trực tiếp vào học phí luôn hay sao ạ?,ACADEMIC
Vậy nếu rớt môn năm nhất thì có bị thu hồi học bổng ko thầy/cô?,ACADEMIC
Cái phí nhập học 25% là phí gì vậy ạ? TDTU mình có phí nhập học hả?,ACADEMIC
Vậy là học bổng thạc sĩ chỉ xét sau năm nhất hả thầy/cô?,ACADEMIC
"Nếu rớt môn thì tự đóng tiền học lại, học bổng ko cover đúng ko ạ?",ACADEMIC
Ký túc xá lưu học sinh có khác gì ký túc xá sv Việt Nam ko ta?,ACADEMIC
Ưu tiên quốc gia vậy có nghĩa là sv ASEAN dễ có học bổng hơn mấy bạn châu Âu hả ad?,ACADEMIC
"Học bổng tiến sĩ chi cuối mỗi học kỳ năm nhất, vậy kỳ đầu tiên mình tự túc hết hả thầy/cô?",ACADEMIC
"Link ""tại đây"" bị die rồi hả ad?",ACADEMIC
Mẫu đơn online đó down về điền hay điền trực tiếp trên web luôn á?,ACADEMIC
Học bổng này chỉ dành cho lưu học sinh thôi hả mn? Sv Việt có apply đc ko?,ACADEMIC
Nộp online xong có cần nộp bản cứng nữa ko ạ?,ACADEMIC
Deadline nộp đơn là khi nào vậy mấy bạn?,ACADEMIC
Học bổng này chỉ dành cho sv quốc tế thôi hả thầy/cô?,ACADEMIC
Nếu mình đang học thạc sĩ năm 2 thì ko apply đc học bổng này đúng ko ạ?,ACADEMIC
Học bổng này có cover hết học phí ko thầy/cô?,ACADEMIC
TDTU có nhiều loại học bổng cho sv thạc sĩ/tiến sĩ không ạ?,ACADEMIC
Nếu đang học tiến sĩ năm 3 thì có cơ hội nhận học bổng này ko ạ?,ACADEMIC
Tóm lại là quy chế này chỉ áp dụng cho sv thạc sĩ khóa 2025 trở đi thôi hả thầy/cô?,ACADEMIC
Vậy mấy anh chị khóa trước 2025 thì không bị ảnh hưởng gì đúng không ạ?,ACADEMIC
Nếu em nhập học năm 2024 thì vẫn theo quy chế cũ của TDTU đúng không?,ACADEMIC
Quy chế này có khác biệt lớn so với quy chế cũ không ạ?,ACADEMIC
Có chỗ nào có thể xem chi tiết toàn bộ quy chế mới của đh TDTU không ạ?,ACADEMIC
Vậy là xếp loại tốt nghiệp ảnh hưởng nhiều tới cái này hả thầy/cô?,ACADEMIC
"""Thâm niên công tác tại TDTU"" là chỉ dành cho giảng viên hay sv mình apply được luôn á?",ACADEMIC
"Mấy cái thành tích thể thao, văn nghệ... có cần giấy tờ chứng nhận gì không ạ?",ACADEMIC
Vị trí công tác trong ngành giáo dục thì có giới hạn trường công hay tư không thầy/cô?,ACADEMIC
Nghiên cứu khoa học thì có tính cả mấy cái mình làm thêm ngoài đh không ạ?,ACADEMIC
Nếu tốt nghiệp loại giỏi ở TDTU mà còn phải nhất ngành nữa mới đc học bổng thạc sĩ hả thầy/cô?,ACADEMIC
Giải nhất cấp Bộ là tính giải thưởng gì vậy ạ?,ACADEMIC
Học bổng này có giới hạn số lượng sv được nhận mỗi năm ko ạ?,ACADEMIC
Nếu đạt huy chương vàng SEA Games thì khi nào hết hạn nộp hồ sơ xét học bổng vậy?,ACADEMIC
Vậy là phải tốt nghiệp đh TDTU rồi mới đc xét học bổng này hả thầy/cô?,ACADEMIC
Nếu mình là sv TDTU thì mình sẽ hỏi thế này:,ACADEMIC
Cái vụ học bổng 50% này là chỉ áp dụng cho học viên cao học thôi hả thầy/cô?,ACADEMIC
Nếu mình có bài báo chung với thầy cô hướng dẫn mà thầy cô không phải giảng viên cơ hữu TDTU thì có được xét không ạ?,ACADEMIC
Tốt nghiệp loại giỏi mà đi nghĩa vụ quân sự xong mới học cao học thì còn được tính là dự tuyển trong vòng 1 năm ko thầy/cô?,ACADEMIC
Giải nhì cấp quốc gia cuộc thi SV nghiên cứu khoa học có được tính là thành tích xuất sắc trong lĩnh vực khoa học công nghệ ko ạ?,ACADEMIC
Học bổng này có áp dụng cho sv liên thông lên đh không ạ?,ACADEMIC
Nếu mình tốt nghiệp loại giỏi ở TDTU thì có chắc chắn được học bổng 30% ko ạ?,ACADEMIC
Thời gian từ lúc tốt nghiệp đến lúc nộp hồ sơ thạc sĩ tính theo ngày hay tháng vậy ạ?,ACADEMIC
Nếu mình là con của giảng viên TDTU thì có được xét học bổng này không?,ACADEMIC
Giải ba cấp trường có được tính là thành tích để xét học bổng này ko ạ?,ACADEMIC
Học bổng này có áp dụng cho sv liên thông từ trường khác lên đh TDTU ko ạ?,ACADEMIC
Nếu mình là cựu sv TDTU thì auto đc học bổng 25% hả thầy/cô?,ACADEMIC
Tốt nghiệp giỏi đh khác mà ko phải công lập thì ko đc xét học bổng hả ad?,ACADEMIC
"Giáo viên cấp 2 có đc tính là ""cơ sở giáo dục phổ thông"" để đc xét ko ạ?",ACADEMIC
"Huy chương bạc giải thể thao sinh viên toàn quốc có đc tính là ""đại hội thể dục thể thao toàn quốc"" ko ạ?",ACADEMIC
Nếu đạt giải ba nghiên cứu khoa học cấp bộ thì có đc học bổng này ko thầy/cô?,ACADEMIC
Học bổng này có áp dụng cho sv năm nhất đh không ạ?,ACADEMIC
Nếu rớt môn thì có bị trừ học bổng không?,ACADEMIC
Thanh toán học phí trễ thì có được xét học bổng không ạ?,ACADEMIC
Công bố khoa học từ hồi đh khác có được tính không?,ACADEMIC
Điểm tb năm nhất thấp hơn 6.5 có bị mất học bổng năm sau không?,ACADEMIC
Học bổng này cần bảng điểm đh có cần công chứng ko ạ?,ACADEMIC
Nếu là viên chức TDTU thì giấy xác nhận đang công tác lấy ở đâu vậy?,ACADEMIC
Giải thể thao cấp trường có được tính là thành tích để xét học bổng ko?,ACADEMIC
"WoS/Scopus là gì vậy ạ, mình ko rành lắm?",ACADEMIC
Nếu chưa có bài báo nào thì có nộp được đơn xin học bổng không ạ?,ACADEMIC
Hạn chót nộp lệ phí đợt 1 là khi nào vậy ạ?,ADMISSION
Thi năng khiếu ở Nha Trang thi môn giống ở SG ko ạ?,ADMISSION
Link giới thiệu bài thi năng khiếu thể thao ở đâu vậy?,ADMISSION
Nếu lỡ đóng tiền sau 17h ngày 31/5 thì có được thi đợt 2 ko ạ?,ADMISSION
Sv TDTU có được ưu tiên gì khi thi năng khiếu ko thầy/cô?,ADMISSION
Tên đăng nhập với pass lấy ở đâu zậy?,ADMISSION
Đổi pass xong lỡ quên thì sao ta?,ADMISSION
Pass mới có cần yêu cầu gì đặc biệt ko mấy bạn?,ADMISSION
Khi nào thì hệ thống cấp tk với pass cho sv vậy?,ADMISSION
Đổi pass xong có cần xác nhận lại với TDTU ko?,ADMISSION
"Alo, em muốn sửa thông tin đăng ký thì liên hệ số nào ạ?",ADMISSION
"Dạ, giờ hành chính là tới mấy giờ chiều vậy ạ?",ADMISSION
Email tuvantuyensinh@tdtu.edu.vn có check thường xuyên ko ạ? Em gửi mail chắc chắn đc hỗ trợ ko?,ADMISSION
Em gọi hotline 19002024 có gặp đc ng tư vấn trực tiếp ko hay chỉ nghe ghi âm thôi ạ?,ADMISSION
Ban tuyển sinh TDTU có hỗ trợ sv sửa thông tin ngoài giờ hành chính ko ạ?,ADMISSION
Ảnh 3x4 là ảnh thẻ đúng ko ạ?,ADMISSION
Deadline nộp tiền thi là khi nào zậy?,ADMISSION
Nếu lỡ ko thi thì có được trả lại tiền ko ta?,ADMISSION
Một đợt thi mình được thi mấy môn á?,ADMISSION
Ảnh thẻ tự chụp rồi up lên được ko hay phải ra tiệm chụp?,ADMISSION
Lịch thi xem ở đâu zậy?,ADMISSION
In giấy báo dự thi trễ nhất là khi nào ta?,ADMISSION
Giấy báo dự thi có cần thiết mang theo ko?,ADMISSION
Xem kết quả thi ở chỗ tra lịch thi luôn hả?,ADMISSION
Trước ngày thi 5 ngày là tính ngày thi luôn hay sao á?,ADMISSION
Đăng ký xong rồi thì phải đọc cái gì nữa vậy ta?,ADMISSION
Lỡ xài trình duyệt khác Chrome thì có sao ko mấy bạn?,ADMISSION
"Màn hình nào có hướng dẫn vậy, tìm hoài ko thấy?",ADMISSION
Sao sv hay bị lỗi cập nhật dữ liệu vậy nhỉ?,ADMISSION
"TDTU có hỗ trợ mấy trình duyệt khác ko, hay chỉ Chrome thôi?",ADMISSION
"Cho em hỏi chỗ ""Họ và tên lót"" với ""Tên"" tách ra vậy là sao ạ?",ADMISSION
"Cái ""Căn cước công dân/Mã định danh"" phải nhập đúng y chang trên hệ thống của Bộ GD&ĐT hả thầy/cô?",ADMISSION
"Chỗ ""Hộ khẩu"" mình nhập theo hộ khẩu thường trú hay sao ạ?",ADMISSION
"""Địa chỉ liên hệ"" với ""Hộ khẩu"" nếu giống nhau thì mình ghi sao ta?",ADMISSION
Email trường cấp cho sv TDTU mình điền vô đây được không ạ?,ADMISSION
Vậy cái mã trường này là mã trường THPT mình học hả mn?,ADMISSION
Cái này nộp để làm gì v ta?,ADMISSION
Tdtu cần thông tin này để check cái j á?,ADMISSION
"Nếu năm lớp 10, 11 học trường khác nhau thì sao ạ?",ADMISSION
"Có cần phải ghi chính xác 100% không, lỡ quên mã trường cấp 3 thì sao các bro?",ADMISSION
IELTS 5.0 mà hết hạn trc 1/10/2022 là ko đc tính hả thầy/cô?,ADMISSION
Nếu ko có IELTS thì bắt buộc phải thi năng khiếu TA ở web đó hả ad?,ADMISSION
Thi năng khiếu TA thì bao giờ có lịch thi vậy ạ?,ADMISSION
Chứng chỉ khác IELTS mà tương đương 5.0 thì có đc ko ạ?,ADMISSION
Sv năm nhất TDTU có cần cái này ko ta?,ADMISSION
"- PT 1, 3 đợt 1 là gì v ạ?",ADMISSION
"- Nếu xét PT 1, 3 đợt 1 thì chỉ đc thi đợt 1 thôi hả mn?",ADMISSION
- Đợt 2 ở Khánh Hòa thì sv TDTU mình có thi đc ko ạ?,ADMISSION
- Thi năng lực TA trực tuyến hay trực tiếp v mọi ng?,ADMISSION
"- Ảnh 3x4 up lên cần đúng 300KB ko ạ, nhỏ hơn xíu đc ko?",ADMISSION
Em muốn làm thẻ sv thì liên hệ ở đâu ạ?,ACADEMIC
Giấy chứng nhận sv xin ở đây luôn hả thầy/cô?,ACADEMIC
Gia hạn học phí thì cần giấy tờ gì không ạ?,ACADEMIC
Học bổng có những loại nào vậy ạ?,ACADEMIC
Web student.tdtu.edu.vn có thông tin gì quan trọng không ạ?,ACADEMIC
Alo phòng KH-TC TDTU cho em hỏi xíu về học phí ạ?,ACADEMIC
Email phongkhtc@tdtu.edu.vn là để hỏi tất tần tật về học phí luôn hả thầy/cô?,ACADEMIC
Em đóng tiền rồi muốn đổi biên lai thì liên hệ trực tiếp số này được không ạ?,ACADEMIC
Số (028) 37755070 này gọi giờ hành chính là có người bắt máy đúng không ạ?,ACADEMIC
Vậy nếu em có thắc mắc về các khoản phí khác ngoài học phí thì vẫn liên hệ đây được đúng không ạ?,ACADEMIC
"Alo, cho hỏi cái này là chỉ phản ánh mấy vụ thi cử của sv TDTU thôi hả?",ACADEMIC
Email này dùng để hỏi về việc phúc khảo bài thi được không ạ?,ACADEMIC
Nếu mất bằng đh thì liên hệ số này để làm lại hả ad?,ACADEMIC
Số điện thoại này có hỗ trợ phản ánh về việc chấm điểm trên moodle không ạ?,ACADEMIC
Dtqa@tdtu.edu.vn có nhận phản ánh về đề thi bị sai không ạ?,ACADEMIC
Em muốn đăng ký môn học thì vào web nào trường mình ạ?,ACADEMIC
Xếp thời khóa biểu đh TDTU ở đâu vậy ạ?,ACADEMIC
Danh sách thi với lịch thi xem ở đâu vậy mấy anh chị?,ACADEMIC
Xét tốt nghiệp với xử lý học vụ thì liên hệ phòng nào ạ?,ACADEMIC
Em có chứng chỉ tiếng Anh với MOS thì nộp để xét miễn ở đâu ta?,ACADEMIC
Cho em hỏi về quy chế học vụ thì xem ở đâu ạ?,ACADEMIC
Web tuvanhocduong có phải chỗ để xem chương trình đào tạo của trường mình ko ạ?,ACADEMIC
Nếu sv có đơn xin xét cái gì đó liên quan đến học vụ thì gửi ở đâu ạ?,ACADEMIC
Trường mình có tư vấn tâm lý cho sv đh hả thầy/cô?,ACADEMIC
Trong quá trình học ở TDTU nếu gặp khó khăn thì liên hệ chỗ nào để được hỗ trợ ạ?,ACADEMIC
Cho em hỏi về thủ tục nộp sổ Đoàn ở đâu ạ?,ACADEMIC
Nếu em muốn rút sổ Đoàn thì liên hệ ai và cần giấy tờ gì không ạ?,ACADEMIC
Đoàn trường có hỗ trợ gì cho sv muốn tham gia các hoạt động tình nguyện không ạ?,ACADEMIC
Email doanhoi@tdtu.edu.vn dùng để giải quyết những vấn đề gì vậy ạ?,ACADEMIC
Em có ý tưởng tổ chức clb ở trường thì liên hệ Đoàn thanh niên TDTU mình như thế nào ạ?,ACADEMIC
CLC có lớp TA chuyên ngành nào cho sv ngành mình ko ạ?,ACADEMIC
Lệ phí mấy khóa ôn luyện chứng chỉ quốc tế là bao nhiêu v ạ?,ACADEMIC
"Ngoài TA, trường mình còn dạy thêm tiếng nào khác nữa ko ạ?",ACADEMIC
TDTU có tổ chức mấy clb ngoại ngữ cho sv giao lưu học hỏi ko ạ?,ACADEMIC
Em muốn tư vấn cách học TA hiệu quả thì liên hệ ai ở CLC đc ạ?,ACADEMIC
Alo trung tâm tin học TDTU hả?,ACADEMIC
Web cait.tdtu.edu.vn có thông tin lịch thi MOS không ạ?,ACADEMIC
Email trungtamtinhoc@tdtu.edu.vn để hỏi về lớp tin học cơ bản được không ạ?,ACADEMIC
Số (028)37761046 gọi giờ nào thì có người nghe máy vậy ạ?,ACADEMIC
Sv muốn đăng ký học lại tin học thì liên hệ qua đâu nhanh nhất ạ?,ACADEMIC
Cho em hỏi về mấy cái chương trình tham quan doanh nghiệp á?,ACADEMIC
Trường mình có hỗ trợ tìm chỗ trọ cho sv mới không ạ?,ACADEMIC
Thông tin về hội cựu sv TDTU mình tìm ở đâu vậy ạ?,ACADEMIC
Em muốn tìm việc làm thêm thì liên hệ ở đâu trường mình?,ACADEMIC
Mấy cái hoạt động hợp tác với doanh nghiệp có yêu cầu gì đặc biệt không ạ?,ACADEMIC
